<?xml version="1.0" encoding="UTF-8"?>
<!DOCTYPE squale PUBLIC "-//Squale//DTD Grid Configuration 1.1//EN" "file:../org/squale/squalecommon/dtd/grid-1.1.dtd">

<squale>
	<practiceset>
		<!-- pratique non utilisÃ©e pour le moment -->
		<practice name="blob" effort="50">
			<weight>lambda x:9.**-x</weight>
			<conditionformula>
				<level>class</level>
				<measures>
					<measure>mccabe</measure>
				</measures>
				<trigger>mccabe.wmc >= 8 and mccabe.maxvg >= 15</trigger>
				<conditions>
					<condition>mccabe.maxvg >= 0.5*mccabe.sumvg</condition>
					<condition>mccabe.maxvg >= 0.4*mccabe.sumvg</condition>
					<condition>mccabe.maxvg >= 0.3*mccabe.sumvg</condition>
				</conditions>
			</conditionformula>
		</practice>

		<practice name="copypaste" effort="30">
			<weight>lambda x:9**-x</weight>
            <simpleformula>
                <level>project</level>
                <measures>
                    <measure>copypaste</measure>
                    <measure>mccabe</measure>
                </measures>
                <trigger></trigger>
                <formula>3*(2./3.)**(100.*copypaste.duplicateLinesNumber/mccabe.projectsloc)</formula>
            </simpleformula>
		</practice>

        <practice name="documentation" effort="10">
			<weight>lambda x:9.**-x</weight>
            <simpleformula>
                <level>method</level>
                <measures>
                    <measure>mccabe</measure>
                </measures>
                <trigger>(mccabe.vg > 5 or mccabe.nsloc > 30) and mccabe.nsloc != 0</trigger>
                <formula> (mccabe.ncloc)*9./(mccabe.ncloc+mccabe.nsloc) / (1. - 10**(-mccabe.vg /15.))</formula>
            </simpleformula>
            <helpKey>documentationKey</helpKey>
        </practice>

		<practice name="modulesize" effort="20">
			<weight>lambda x:30.**-x</weight>
			<simpleformula>
				<level>method</level>
				<measures>
					<measure>mccabe</measure>
				</measures>
				<trigger></trigger>
				<formula>exp((70-mccabe.nsloc)/30.)</formula>
				<!--
					<condition>mccabe.nsloc >= 70</condition>
					<condition>mccabe.nsloc >= 50</condition>
					<condition>mccabe.nsloc >= 40</condition>
				-->
			</simpleformula>
		</practice>

		<practice name="spaghetticode" effort="30">
			<weight>lambda x:30.**-x</weight>
			<simpleformula>
				<level>method</level>
				<measures>
					<measure>mccabe</measure>
				</measures>
				<trigger></trigger>
				<formula>exp((6-mccabe.evg)/4.)</formula>
				<!--
					<condition>mccabe.evg >= 7</condition>
					<condition>mccabe.evg >= 6</condition>
					<condition>mccabe.evg >= 3</condition>
				-->
			</simpleformula>
		</practice>
		
		<practice name="deadcode" effort="5">
			<weight>lambda x:9.**-x</weight>
			<conditionformula>
				<level>method</level>
				<measures>
					<measure>mccabe</measure>
				</measures>
				<trigger></trigger>
				<conditions>
					<condition>mccabe.deadCode</condition>
					<condition>0</condition>
					<condition>0</condition>
				</conditions>
			</conditionformula>
		</practice>
			
	</practiceset>

	<criteriumset>
		<criterium name="comprehension">
			<practice-ref name="documentation" weight="1" />
			<practice-ref name="deadcode" weight="1" />
		</criterium>

		<criterium name="modularity">
			<practice-ref name="copypaste" weight="1" />
		</criterium>

		<criterium name="simplicity">
			<practice-ref name="modulesize" weight="1" />
			<practice-ref name="spaghetticode" weight="1" />
		</criterium>
	</criteriumset>

	<factorset>
		<factor name="evolutionarity">
			<criterium-ref name="comprehension" weight="1" />
			<criterium-ref name="modularity" weight="1" />
		</factor>

		<factor name="maintainability">
			<criterium-ref name="comprehension" weight="1" />
			<criterium-ref name="simplicity" weight="1" />
		</factor>

		<factor name="reliability">
			<criterium-ref name="simplicity" weight="1" />
		</factor>

		<factor name="reusecapacity">
			<criterium-ref name="comprehension" weight="1" />
		</factor>
	</factorset>

	<gridset>
		<grid name="cobol">
			<factor-ref name="evolutionarity" />
			<factor-ref name="maintainability" />
			<factor-ref name="reliability" />
			<factor-ref name="reusecapacity" />
		</grid>
	</gridset>
</squale>
